{
  "id": "apply-style",
  "version": "1.0",
  "title": "Apply Swift + SwiftUI style guides",
  "goal": "Ensure the change matches Swift and SwiftUI style guides.",
  "steps": [
    {
      "text": "Identify the target files and intended behavior."
    },
    {
      "text": "Apply Swift and SwiftUI style rules consistently."
    },
    {
      "text": "Avoid unrelated refactors.",
      "requiresReview": true
    },
    {
      "text": "Update or add tests as needed."
    },
    {
      "text": "Provide a concise diff summary."
    }
  ],
  "acceptanceCriteria": [
    "Code matches Swift style guide",
    "Code matches SwiftUI style guide",
    "Tests pass",
    "No unintended behavior changes"
  ],
  "verification": [
    {
      "kind": "command",
      "text": "swift test"
    },
    {
      "kind": "manual",
      "text": "Review diff for scope creep"
    }
  ],
  "requiresIntentTemplateIds": [
    "swift-refactor-safe"
  ],
  "requiresSkillIds": [
    "codex-cli"
  ],
  "referenceIds": [
    "swift-style-guide-reference",
    "swiftui-style-guide-reference"
  ]
}
