{
  "id": "run-gated-worktree-delivery-loop",
  "version": "1.0",
  "title": "Run gated worktree delivery loop",
  "goal": "Deliver the highest-priority bounded objective through deterministic gates in a dedicated non-main worktree with explicit approval control.",
  "steps": [
    {
      "text": "Review objective, constraints, approved gate boundary, and `worktree-squad-gating-contract` for this loop."
    },
    {
      "text": "Verify branch/worktree scope is dedicated and non-main; record commit authorization mode before editing."
    },
    {
      "text": "Sync with Samwise on orchestration ownership for this loop and confirm gate boundary decisions."
    },
    {
      "text": "Decompose objective into smallest reviewable work item with acceptance criteria and verification commands."
    },
    {
      "text": "Assign lane ownership and write scope for implementation, reliability, design QA, and product QA."
    },
    {
      "text": "Implement only the selected work item, then run required verification checks and record evidence."
    },
    {
      "text": "Pause for AJ review before crossing the next gate or creating a commit when per-commit approval mode is active.",
      "requiresReview": true
    },
    {
      "text": "Apply approved follow-up actions, append one loop entry using `worktree-squad-loop-log-contract`, update checkpoint summary, and emit next 3 queued actions for resume."
    },
    {
      "text": "When assignment scope is complete, run `worktree-squad-retrospective-review`, produce the retrospective report, and append one retrospective entry using `worktree-squad-retrospective-log-contract`."
    }
  ],
  "acceptanceCriteria": [
    "Active branch/worktree scope and authorization mode are explicitly recorded",
    "Exactly one bounded work item is completed per loop unless AJ expands scope",
    "Verification evidence is captured for required checks",
    "Staff-level code review findings are recorded with blocker/major/minor severity",
    "Samwise orchestration sync is recorded for lane ownership and gate decisions",
    "One loop entry is appended per completed loop",
    "Assignment closeout includes a retrospective report and retrospective JSONL entry",
    "Gate status and residual risks are updated in checkpoint notes",
    "No commit occurs without AJ-approved authorization mode for the current scope"
  ],
  "verification": [
    {
      "kind": "manual",
      "text": "Confirm branch/worktree scope is recorded and non-main before implementation begins"
    },
    {
      "kind": "manual",
      "text": "Confirm required verification commands and outcomes are recorded in checkpoint notes"
    },
    {
      "kind": "manual",
      "text": "Confirm staff-level review notes include severity and disposition before gate advancement"
    },
    {
      "kind": "manual",
      "text": "Confirm loop entries satisfy `worktree-squad-loop-log-contract` and retrospective closeout satisfies `worktree-squad-retrospective-log-contract`"
    },
    {
      "kind": "manual",
      "text": "Confirm gate decision and next actions are explicit before handoff"
    }
  ],
  "workstream": {
    "id": "worktree-squad-lifecycle",
    "phase": "delivery",
    "entrySessionId": "samwise-squad-planning",
    "requiredCloseoutSessionId": "worktree-squad-retrospective",
    "nodes": [
      {
        "sessionId": "samwise-squad-planning",
        "phase": "planning"
      },
      {
        "sessionId": "samwise-worktree-squad-oversight",
        "phase": "oversight"
      },
      {
        "sessionId": "worktree-squad-delivery",
        "phase": "delivery"
      },
      {
        "sessionId": "worktree-squad-retrospective",
        "phase": "retrospective"
      },
      {
        "sessionId": "rosie-retrospective-garden",
        "phase": "gardening"
      }
    ],
    "edges": [
      {
        "fromSessionId": "samwise-squad-planning",
        "toSessionId": "samwise-worktree-squad-oversight",
        "kind": "required-next"
      },
      {
        "fromSessionId": "samwise-worktree-squad-oversight",
        "toSessionId": "worktree-squad-delivery",
        "kind": "required-next"
      },
      {
        "fromSessionId": "worktree-squad-delivery",
        "toSessionId": "worktree-squad-retrospective",
        "kind": "required-closeout"
      },
      {
        "fromSessionId": "worktree-squad-retrospective",
        "toSessionId": "rosie-retrospective-garden",
        "kind": "optional-follow-up"
      }
    ]
  },
  "requiresIntentTemplateIds": [
    "gated-worktree-delivery"
  ],
  "requiresSkillIds": [
    "codex-cli"
  ]
}
