{
  "id": "oversee-worktree-squad-delivery",
  "version": "1.0",
  "title": "Oversee worktree squad delivery",
  "goal": "Let Samwise orchestrate a gated worktree delivery loop by supervising Worktree Squad Lead execution, evidence quality, and gate decisions.",
  "steps": [
    {
      "text": "Review AJ objective, approved checkpoint gate, scope constraints, and commit authorization mode."
    },
    {
      "text": "Confirm protected branch policy and isolated worktree scope before delegating implementation loops."
    },
    {
      "text": "Assign one bounded work item to Worktree Squad Lead and require explicit acceptance criteria plus verification commands."
    },
    {
      "text": "Review returned implementation/review evidence and verify blocker/major/minor findings are triaged with disposition."
    },
    {
      "text": "Pause for AJ review before any commit when per-commit approval mode is active or when a gate crossing is proposed.",
      "requiresReview": true
    },
    {
      "text": "Apply approved next action, ensure active loop log entries are appended per contract with derived workstream routing when the active directive is workstream-aware, queue retrospective closeout when assignment scope completes, update checkpoint summary, and queue next 3 actions."
    }
  ],
  "acceptanceCriteria": [
    "Samwise and Worktree Squad Lead responsibilities are explicitly separated and recorded",
    "One bounded work item is completed with verification evidence and review triage",
    "Protected main policy and authorization mode are recorded for the active loop",
    "Loop entries are recorded for continuity with derived workstream routing when the active directive is workstream-aware, and retrospective closeout is explicit when assignment scope completes",
    "No commit occurs without AJ-approved authorization for the current scope",
    "Checkpoint notes include shipped, blocked, and next actions"
  ],
  "verification": [
    {
      "kind": "manual",
      "text": "Confirm delegation to Worktree Squad Lead included acceptance criteria and verification commands"
    },
    {
      "kind": "manual",
      "text": "Confirm review evidence includes severity triage and disposition"
    },
    {
      "kind": "manual",
      "text": "Confirm active loop entries satisfy the worktree-squad loop log contract and retrospective closeout is explicit when assignment scope completes"
    },
    {
      "kind": "manual",
      "text": "Confirm workstream-aware loop entries record a derived workstream routing summary without treating the log as the routing source of truth"
    },
    {
      "kind": "manual",
      "text": "Confirm checkpoint summary includes shipped, blocked, and next actions"
    }
  ],
  "workstream": {
    "id": "worktree-squad-lifecycle",
    "phase": "oversight",
    "entrySessionId": "samwise-squad-planning",
    "requiredCloseoutSessionId": "worktree-squad-retrospective",
    "nodes": [
      {
        "sessionId": "samwise-squad-planning",
        "phase": "planning"
      },
      {
        "sessionId": "samwise-worktree-squad-oversight",
        "phase": "oversight"
      },
      {
        "sessionId": "worktree-squad-delivery",
        "phase": "delivery"
      },
      {
        "sessionId": "worktree-squad-retrospective",
        "phase": "retrospective"
      },
      {
        "sessionId": "rosie-retrospective-garden",
        "phase": "gardening"
      }
    ],
    "edges": [
      {
        "fromSessionId": "samwise-squad-planning",
        "toSessionId": "samwise-worktree-squad-oversight",
        "kind": "required-next"
      },
      {
        "fromSessionId": "samwise-worktree-squad-oversight",
        "toSessionId": "worktree-squad-delivery",
        "kind": "required-next"
      },
      {
        "fromSessionId": "worktree-squad-delivery",
        "toSessionId": "worktree-squad-retrospective",
        "kind": "required-closeout"
      },
      {
        "fromSessionId": "worktree-squad-retrospective",
        "toSessionId": "rosie-retrospective-garden",
        "kind": "optional-follow-up"
      }
    ]
  },
  "requiresIntentTemplateIds": [
    "gated-worktree-delivery",
    "partner-sync-review"
  ],
  "requiresSkillIds": [
    "codex-cli"
  ]
}
